{
  "status": "tak",
  "total_length_value": 1234,
  "average_coverage_value": 100.34,
  "number_of_Ns_value": 34,
  "number_of_ambiguous_value": 5,
  "coverage_histogram_file": "/path/to/a/file",

  "coverage_barplot_data": [
    {
      "segment_name": "MN09345",
      "segment_file": "/path/to/a/file"
    }
  ],
  "primer_usage_data": [
    {
      "segment_name": "chr4_HA",
      "primer_data": [
        {
          "primer_name": "Primer1",
          "primer_usage": 10
        },
        {
          "primer_name": "Primer1",
          "primer_usage": 10
        }
      ]
    }
  ]
}
